กระถางต้นไม้ขนาด 12 นิ้วหรือ 30 เซ็น พลาสติกดูดีแต่มีตําหนิบ้างเล็กน้อยโดยรวมราคาถูกกว่าซื้อข้างนอก|fake
กระถางต้นไม้สวยงามมากคร่าาาาาาา ส่งไว ห่อกันกระแทกมาดีมากคะ มีซื้อต่อแน่นอน ขนส่งดีมากกกกกกคะ|fake
กระถางน่ารัก เนื้อหนา รูปทรงสวย พัสดุจัดส่งดีไม่เสียหาย ส่งไว ห่อแน่นหนามากกกก แถมราคาไม่แรง|fake
กระถางเบลล่า ราคาถูกกว่าท้องตลาด แพคสินค้าและจัดส่งรวดเร็วเหมือนอยู่แค่ปากซอย|fake
กระถางเบลล่าจัดส่งค่อนข้างช้า ไม่รู้ว่า เป็น เพราะขนส่งหรือเปล่า แต่สินค้าสวยดีค่ะ ความคุ้มค่าดีมาก แต่ส่งช้าไปหน่อย|fake
กระถางเบลล่าร้านนี้สวยมาก​ จัดส่งมาดีไม่มีแตก​ แพคของสวยงาม​ สีสันสวยด้วย​ ราคาถูกกว่า|fake
กระถางเบลล่าสีขาว9นิ้วใบใหญ่กว่าที่คิดคุ้มมากกับราคาออกแบบทันสมัยจานรองไม่ต้องกลัวยุงมาไข่ พลาสติกแข็งแรง|fake
กระถางสวยงาม พลาสติกดูแข็งแรงทนทาน ออกแบบสวยหรูดูแพง การจัดส่งสินค้าตามกําหนดเวลารวดเร็วทันใจ|fake
กระถางสวยน่ารัก ตรงปกค่าาา|fake
กระถางสวยมาก​ ริานส่งของเร็วด้วย​ สองวันก็ถึง​ คุณ​ภาพ​ดี​คือดีมาก​ สั่งอีกแน่นอน​ ร้านนี้|fake
กระถางสวยมากค่ะ|fake
กระถางสีเทาสวยหรูดูแพง​ คลาสสิค​ ไม่เอ้าท์​ ดูแลควสมสะอาดง่าย​ จัดส่ง​สินค้า​แพค​มาดี​สวยงาม|fake
การจัดส่งถือว่าเร็วใช้ได้มากๆๆๆๆหีบห่อบรรจุภัณฑ์ดี แพ็กสินค้ามาอย่างดีไม่เสียหาย สินค้าคุณภาพดีคุ้มราคาที่จ่ายไป ไว้ถ้าลองใช้ใช้ดีจะกลับมาซื้ออีก|fake
ของมาส่งไว ห่อมาอย่างดี เดี๋ยวซื้อเพิ่มอีก 2 ใบ ขอบๆๆๆ แข็งแรง เก็บน้ําได้ดี ขนาดเหมาะ สวยเลย|fake
ขอบแตกชํารุด2ใบขอบบีบอัดกันเอง|fake
คุณภาพเกินราคาค่ะ ดี|fake
คุณภาพดีมาก สวย แพ็คดี ได้รับของเร็ว|fake
จัดส่งเร็ว สวย แต่เราได้สินค้าที่น่าจะมีตําหนิเล็กน้อยเพราะฐานใส่ยากมากๆทั้งสองใบเลย ปกติฐานรองจะใส่ง่ายไม่ยากขนาดนี้ พยายามอยุ่สองวัน ก้อยังไม่ได้ ให้แฟนทําให้ก้อยังได้เท่าที่เห็น|fake
จัดส่งเร็วดีค่ะ แพคกันกระแทกมาอย่างหนามาก ใช้โค้ดส่งฟรี มีเสียค่าส่งเพิ่มนิดหน่อย ราคาไม่แพงค่ะ|fake
จัดส่งไว แพ็คสินค้ามาดีไม่มีเสียหาย ของจริงใหญ่มากกว่าที่คิด เลยตั้งขาตั้งไม้ขนาด10นิ้วไม่ได้|fake
จัดส่งไวมากค่ะ ประทับใจ ห่อมาหนาแน่ดี ของมาสภาพสมบูรณ์ สวย ทันสมัย ขนส่งบริการดีสุภาพโทรแจ้งล่วงหน้าก่อนสินค้าจะมาถึง โดยรวมพอใจมากค่ะ ไว้จะอุดหนุนอีกแน่นอนค่ะ|fake
ซื่อมา3ใบ ถาดรองปิดไม่สนิท1ใบ ไม่ทราบว่าเป็นเพราะอะไร มาตรฐานอยู่ตรงไหน|fake
ซื้อมาจากร้านเดียวกัน 2 size ถูกใจทั้งคู่ เคยใช้แล้ว ทนแดด สียังไม่ซีด|fake
ซื้อหลายใบแล้วค่ะประกอบง่ายเวลาลงต้นไม้แล้วสวยงามมากดูดีมีราคาขึ้นมาทันทีค่ะรักๆ|fake
ดรมากกว่านี้อีกแล้วครับขอบคุณครับผมไม่รู้ว่ามันเป็นเรื่องที่ไม่มีใครรู้จักกันดีกว่า|fake
ดีค่ะ ได้ของครบ สีสวย เคยใช้แล้วสีไม่ซีดกับแดด ขนาดได้อย่างที่ต้องการค่ะ|fake
ดีค่ะ ส่งของดี ใหญ่ ชอบอ่ะ สั่งเพิ่มอีกแน่นอน|fake
ดีมากค่แพคอบ่างดี|fake
ดีมากค่ะเดี๋ยวจะสั่งของเพิ่มอีกให้ใหญ่ใหญ่กว่านี้วัสดุแข็งแรงดีมาก สั่งเพิ่มอีกแน่นอน ร้านนี้ถูกใจมากค่ะ ราคาดี|fake
ดีมากค่ะสําหรับข้อเสนอพิเศษถึงความสําคัญกับเรื่องราวของความเป็นมาก่อนหน้านั้นจะต้องทํา|fake
ดีมากเลยค่ะแต่ไม่มีใครรู้จักกันดีกว่าครับเพราะว่ามันเป็นเรื่องที่ไม่มีใครรู้จักกัน|fake
ดีสวยแพ็คมาดี|fake
โดยรวมสินค้าดีแต่ค่าขนส่งแพง ง่ายต่อการทําความสะอาดและดูแลรักษา,|fake
ได้รับของครบถ้วนค่ะ ส่งไว|fake
ได้รับของเร็ว​ ถูกต้องครบถ้วน​ ของสวยงามตามรูป​ราคาถูกดี​ ห่อกันแตกมาอย่างหนา​ ไม่มีเสียหาย​|fake
ได้รับของเรียบร้อย แพคมาในห่อ ส่งเร็วมาก ไม่เสียหาย ได้รับของครบตามที่สั่ง สินค้าคุณภาพดี|fake
ได้รับสินค้าครบ ตรงตามที่สั่งไป สินค้าไม่เสียหาย วัสดุแข็งแรงดี พนักงานส่งโทรแจ้งล่วงหน้า|fake
ได้รับสินค้าตรงตามที่สั่งซื้อ สินค้าถูกต้องตรงกับที่ลงโฆษณาไว้ ร่านค้าส่งสินค้ารวดเร็ว|fake
ได้รับสินค้าเรียบร้อยดีครับตัวสินค้าดีครับเอาไว้ใช้ดียังไงจะอุดหนุนใหม่นะครับ ดีครับ|fake
ได้รับสินค้าแล้ว แข็งแรงสวยงาม แต่วัดความกว้างของขอบกระถางได้แต่ 8 นิ้ว|fake
ได้รับสินค้าแล้ว ตรงปก ขนาดกําลังดี ราคาไม่แพง พลาสสติกแข็งแรง จัดส่งฟรีส่งไว พนักงานส่งสุภาพและมีโทรมาก่อน|fake
ได้รับสินค้าแล้ว บอบบางไปหน่อย ไม่เหมือนกับใบโตๆ แต่พยายามใส่ก้นกระถางลําบากครับ มันไม่ยอมเข้า|fake
ได้รับสินค้าแล้วใช้ดี สินค้าดีมีคุณภาพ โดยรวมแล้วชาบซื้อรอบสองเรียบร้อยแล้วค่ะ ตรงปก|fake
ได้รับสินค้าแล้วได้ครบตามที่สั่งไปทางร้านส่งให้ไวมากค่ะตัวกระถางเป็นพลาสติกความกนาดีแต่เบา|fake
ตรงปก แพ็คดี ไม่มีเสียหาย ส่งเร็ว ของดี วัสดุดี มีรูระบายน้ํา สีสวย มินิมอลมากมากค่ะ ราคาดี|fake
ตรงปก ลูกใหญ่ ฐานแตกไปนิดนึง|fake
ตรงปก สวยงาม|fake
แตกทั้ง สองใบ จานรอง ส่งมาใหม่ได้ไหม|fake
ทรงน่ารัก ขนาดกําลังดี ประกอบถาดง่ายกว่าขนาด 12นิ้ว ราคาโปรสุดคุ้ม ทรงน่ารัก ขนาดกําลังดี ประกอบถาดง่ายกว่าขนาด 12นิ้ว ราคาโปรสุดคุ้ม|fake
ทางร้านแพ็คสินค้ามาเป็นอย่างดีเหมือนเดิม และจัดส่งรวดเร็วดี กระถางเบลล่า 9 นิ้ว สีขาว ทรงสวย พลาสติกหนา ขนาดใหญ่กําลังดี โปร 25.2 ได้ส่วนลดจากร้านและลาซาด้า คุ้มดีครับ|fake
แนะนําสินค้าร้านนนี้ สวยมากๆๆๆมชอบมากกกก แนะนํา ราคาถูกอีก โครตชอบเลยครับ แนะนําไว้มาอุดหนุนใหม่นะ ตรงปกมาก|fake
ใบใหญ่สวยค่ะ|fake
ปฝาที่ก้นกระถ่งใส่ไม่ได้ เสียเวลาใส่ตั้ว 45 นาทีแล้วผิดหวังมาก|fake
แพ็คซ้อนกันมา เพื่อลดพื้นที่จัดส่ง แต่ตอนจะแกะออกจากกันลําบากมาก แถมตอนจะประกอบกลับ ยากไปอีก|fake
แพ็คสินค้า ซ้อนกันมาเพื่อให้ขนส่งได้สะดวก ไม่กินที่ แต่แกะออกจากันไม่ออก กว่าจะแกะได้เกือบถอดใจ พอแกะออกได้ ประกอบไม่ได้อีก กว่าจะประกอบได้ หงุดหงิดเลย|fake
แพ็คสินค้ามาดีมากบริการดีสวยงาม|fake
เยี่ยมครับ|fake
รอของไม่นาน ห่อกันกระแทกมาอย่างเดียว ไม่มีกล่องแต่สถาพดี ไม่ชํารุด ขนาดกําลังดีกับกมรใช้งาน|fake
รอบนี้แพคมาดีมากๆค่ะ|fake
รอบบนี้แพคของมาดีมากๆ รอบหน้าขอแบบนี้อีกนะคะ มีตัวแจ้งกันกระแทกด้วยค่ะ เยี่ยมมากๆเดี๋ยวสั่งอีก|fake
ราคาถูกดี กระถางขนาดใหญ่ดี ทางร้านจัดส่งไว แพ็คของให้เรียบร้อยแน่นหนา ของได้รับไม่เสียหาย|fake
ร้านค้าจัดส่งสินค้าได้รวดเร็วดีมากคุณภาพสินค้าดีอยู่แล้วเหมาะสมกับราคาที่จ่ายไปแล้วจะกลับมาอุดหนุนใหม่อีกนะคะ|fake
ร้านค้าแพคสินค้ามาอย่างดี ไม่เสียหาย ส่งเร็วมาก ร้านค้าแพคสินค้ามาอย่างดี ไม่เสียหาย ส่งเร็วมาก ร้านค้าแพคสินค้ามาอย่างดี ไม่เสียหาย ส่งเร็วมาก|fake
ร้านแพ็คมาแน่นหนา จัดส่งเร็วมาก กระถางใบใหญ่ ดูแข็งแรงคุ้มค่า ด้านล่างมีจุกไว้เปิดระบายน้ํา|fake
ร้านแพ็คสินค้ามาดีค่ะตรงปกตรงตามจํานวนคิดว่ากระถางน่าจะเล็ก12นิ้วไม่เลยจ้าใหญ่ดีมากแนะนําร้านนี้ค่ะ|fake
วัสดุดี คุ้มราคา ได้รับเร็ว|fake
ส่งช้ากว่าที่แจ้งไว้วันนึง แต่ก็ถือว่าเร็วอยู่ 2 วันได้ของ ราคาถูกกว่าตลาด ของแท้ตรวปก|fake
ส่งถึงไว แพคเกจมาดีไม่มีเสียหาย ราคาไม่แพง สินค้าจริงสีสวยและขนาดใบใหญ่มาก เอาต้นไม้ลงยิ่งสวยไปใหญ่|fake
ส่งเร็ว ตรงปก ราคาดีฟรีค่าส่ง แต่ๆๆๆ...ถาดรองแตก1ใบ แต่ก็ให้อภัยค่ะ|fake
ส่งเร็วครับ แต่แตกเสียหาย|fake
ส่งไว แพคดีค่ะ|fake
ส่งไว แพคมาดี ราคาถูก ส่งไว สินค้าไม่ชํารุด|fake
ส่งไว ราคาดีกว่าร้่นอื่น สิ้นค้าดี สั่ง2ครั้งละ|fake
ส่งไวมากค่ะ แพคมาดี|fake
ส่งไวราคาไม่แพง ฝาล่างใหญ่กว่ากระถางบนเล็กน้อย ทําให้หลวม|fake
สวย แข็งแรง แนะนําค่ะ|fake
สวยค่ะแข็งแรงทนทาน|fake
สวยงาม ราคาดี ส่งไว แพ็คสินค้าดี ไว้มาอุดหนุนใหม่|fake
สวยงาม วัสดุ​แข็งแรง การจัดส่ง​เรียบร้อย​ ส่งไว การบรรจุหีบห่อ​แพคมาอย่างกี โดย ๆ รวมดี|fake
สวยงามค่ะ ตรงปกแบบที่คิดไว้ จัดส่งไวมาก ไวทันใจ เดี๋ยวเย็นนี้จะเอาดินใส่ปลูกต้นไม้ ตอนนี้รอขาตั้งอย่ทางเดียว|fake
สวยงามค่ะเดวสั่งซื้อเพิ่มนะคะ|fake
สวยงามจ้า ชอบๆ|fake
สวยดี แพ๊คมาดี|fake
สวยดูแข็งแรงค่ะ ขนาดก็ตรงตามปกเลยค่ะ|fake
สวยตรงปกแพคมาดีพนักงานยริการดีร้านี้แนะนําค่ะ|fake
สวยใบใหญ่มาก ดีคะ ไม่แพง ไม่ต้องออกไปหาซื้อเองสะดวกใช้ ขนส่งไว ใช้ส่วนลดแลกเหรียญ50% ได้อีกเยอะสุดคุ้มมากค่ะ|fake
สวยมาก​ชอบมาก​ ราคาดี​ ร้านส่งของเร็วสองวันก็ถึง​ คุณ​ภาพ​ดี​คือ​ดี​ เสีย​ดายสั่งมาแค่สอง​ สั่งอีกแน่นอน|fake
สวยมากและใหญ่ถูกใจค่ะราคาย่อมเยาเอาไว้อุดหนุนอีกค่ะ|fake
สวยสมราคาหนาดีมีกันกระแทกมาสองชั้นสามชั้นสามชั้นสั่งของได้เร็วสองวันได้ราคาไม่แพง|fake
สั่งสีฟ้า ได้สีขาว มีแตกที่ฐานนิดนึง|fake
สางของไวมากแพคดีค่ะ|fake
สินค้าคุณภาพดีคะ ราคาถูก แพ็คดี ขนส่งเร็ว จะสั่งเพิ่มนะคะ|fake
สินค้าดี จัดส่งรวดเร็ว|fake
สินค้าดีๆ ตรงปก จัดส่งรวดเร็ว สินค้าดีๆ ตรงปก จัดส่งรวดเร็ว สินค้าดีๆ ตรงปก จัดส่งรวดเร็ว|fake
สินค้าดีม่กครับทตรงปกแข็งแรง ใบใหญ่ตามที่คาดหวังสั่งมาสามสีสวยทุกสีราคาไม่แพงเลยครับ|fake
สินค้าแตกหักครับ แจ้งทางร้านไปแล้วครับแต่ยังไม่มีความคืบหน้าครับ|fake
สินค้าแพ็คมาดีบริการดีส่งไวเดี๋ยวสั่งใหม่แนะนําร้านนี้ไม่ผิดหวัง|fake
สินค้ามีคุณภาะสวยงาม แพ็คสินค้ามาดีมากมีกันกระแทกสินค้าไม่เสียหายแล้วจะอุดหนุนอีกนะคะ|fake
สินค้าไม่แพงแต่มีคุณภาพดีค่ะ|fake
สิ้นค้าส่งไว สวยแต่สิ้นค้า ฐานรองแตกไป1 ชิ้น เกิดจากการขนส่งจากการกระแทรก ไม่ชีเรียท คะ|fake
สินค้าสวยดีครับแต่กระถางกับก้นกระถางไม่แน่นหลุดออกจากกันง่าย..แค่จับตัวกระถางยกก้นกระถางก็หลุดแล้วครับ|fake
สีกระถางสวย จัดส่งเร็ว สินค้าจริงใบใหญ่มาก ลงน้องได้ 3 ต้นสวยเลย ร้านค้าแพคสินค้ามาดี ไม่มีเสียหาย|fake
สีขาวเป็นสีที่ดูเรียบหรู​ เหมาะกับปลูกต้นไม้โชว์ไว้สวยๆหน้าบ้าน​ เป็นพลาสติกหนาและแข็งแรง​ดี|fake
สีเทามันเท่ดีค่ะ สั่งมาได้ใบใหญ่มากๆ น่าจะเป็นขนาดใหญ่ที่สุดแล้ว ถ้าเพื่อนๆคนไหนสนใจแนะนําร้านนี้เลยนะคะ ได้ของถูกใจค่ะ|fake
สีพาสเทลน่ารักมาก ทุกสีเลย เหมาะแก่การตั้งหน้าบ้านสวยๆ สีพาสเทลน่ารักมาก ทุกสีเลย เหมาะแก่การตั้งหน้าบ้านสวยๆ|fake
สีสวย ส่งตรงรุ่นขนาด สั่งครั้งที่2แล้วส่งเร็ว|fake
ใส่จานลองกระถาง​ยาากมาก ได้ของมาหลายวันตอนนี้ยังใส่ก้นกระถางไม่ได้​เลย เคยสั่งร้านอื่นมา ใา่ง่ายกว่านี้เยอะเลย|fake
ใหญดีมาก สวยมาก สีสวย จัดส่งเร็ว|fake
