เทียบให้ดูยังไม่ได้แงะ กับแงะออกมาแล้วใบสีขาวที่สั่ง สีสวยดี แต่อยากได้ใบใหญ่ กับได้ ใบเล็ก :.-/|fake
กระบอกน้ําสวยดี เสียอย่างเดียวสั่งสีฟ้าได้สีดํา แต่ไม่เป็นไรค่ะสีดําก็สวย สั่งอีกครั้งสีฟ้า หวังว่าคงจะได้สีฟ้านะคะ|fake
กล่องค่อนข้างยับเยิน แต่ วัสดุภายในตรวจดูแล้ว เรียบร้อย ไม่บุบสลายโดยรวมโอเคครับ ราคาก็ไม่แพง พอรับได้|fake
กล่องเยินมานิดหน่อยพลาสติกชั้นนอกทะลุเลยแต่ของไม่เสียหาย บอกขนาด1300mlแต่ลองใส่น้ําแล้วได้ประมาณ1ลิตร ที่เหลือต้องลองว่าจะเก็บอุณหภูมิได้นานแค่ไหน โดยรวมถือว่าokครับ|fake
แก้วน้ําสวยงาม​ที่สุด​ถูก​ใจ​มาก​ แต่แก้วขนาดน่าจะไม่ถึงเ​1.3ลิตรน่ะ​ แต่สวยดีครับ​ แต่น่ะ​จะถุก​อีกหน่อย|fake
แก้วสวยคุณภาพดีใช้ได้ เก็บความเย็นได้ดีมากเลย ฝาปิดด้านบนแอบเปิด-ปิดยากนิดนึง กระดาษคาดรอบแก้วกาวไม่แน่นลอกออกง่าย|fake
แก้วใหญ่เก็บความเย็นดีเยี่ยม ราคาถูกกว่าข้างนอก แข็งแรงทนทาน ไม่มีไอน้ําเกาะรอบแก้ว เอาไปเลยห้าดาววววว|fake
ขนส่งรอประมาณ 2-3 วันไม่นานขวดน้ํามีตําหนิสีถลอกนิดนึงโดยรวมโอเคได้อยู่ลองใช้ก่อนว่าจะเก็บความเย็นได้ดีเท่าไหร่|fake
ขวดน้ําเก็บความเย็นใช้งานได้ดีค่ะ ใส่น้ําแข็งไว้ตอนเช้าเที่ยงคืนน้ําแข็งยังอยู่เลย เหมาะกับหน้าร้อนตอนนี้มาก|fake
ของดีคุณภาพดีครับก็พอใช้ครับ แต่ได้ของไม่ตรงขนาดที่สั่งครับ ได้เล็กกว่าที่เขารีวิวไว้พูดง่ายๆว่าไม่ค่อยถูกใจครับ|fake
ของสวยโอเคตรงปกอาจจะล่าสุดล่าช้ามากเลยในการส่งรอนานมากร่วมเดือนกว่าจะได้ของนานเกินไป|fake
คุ้มค่า ราคาถูกมาก พกพาง่าย ไปไหนก็สะดวก เหนียมนุ่ม ไม่ขาดง่าย|fake
โคตรใหญ่ ส่งช้าแต่ไม่เป็นไรตรงปกครับ ดีกว่าครับเพราะว่ามันเป็นเรื่องที่ไม่มีใครรู้จัก|fake
งานดีตรงปกไม่หลอกลวงประชาชน ส่งไม่ไวจะได้ของผลิตภัณฑ์ส่งดีไม่มีชํารุด ขอบคุณครับ ที่ให้ของดีๆแบบนี้สําหรับทหารมาใช้ ยินดีให้บริการ ซื้อใหม่อีก|fake
จัดส่งรวดเร็ว สินค้าราคาไม่แพง คุ้มเกินคุ้ม เก็บนํา้แข็งได้ดี1วันเต็ม แนะนําร้านนี้ค่ะ จะสั่งเพิ่มอีกค่ะ|fake
ไช้ดีมากเก็บความเย็น เย็นทนเย็นนาน เย็นข้ามวันข้ามคืน น้ําแขงเหลือครบทุกก้อนแทบไม่ละลาย สู้แดดกว่าน้ําท่อม|fake
ซื้อของกับ Lazada ได้ส่วนลดมากมาย ใช้เหรียญเป็นส่วนลดได้อีกราคาไม่แพง ขนส่งบริการดี ส่งฟรี ถ้ามีโค้ด ถ้ามีเหรียญเยอะ|fake
ซื้อให้เด็กๆไปโรงเรียน ช่วงหน้าร้อนร้อนมาก แต่เก็บความเย็นได้ดีเลยคะ เลิกเรียนมายังเย็นอยู่เลยคะ ไม่มีไอน้ําออกมาเลย แต่รอนานหน่อยนะ เพราะเป็นสินค้าพรีออเดอร์|fake
ดีครับตรงปกมากสั่ง 1.7 ลิตรได้ 1.7 ลิตร ในราคาที่ถูกมาก แนะนําร้านนี้เลยครับ เก็บความเย็นได้ดีเยี่ยม|fake
ดีทีเดียว ขนาดกําลังดี พกพาอิ่ม สีไม่ใช่แดง แต่คือสีส้มนู้ด แต่ไม่ซีเรียส วัดที่คุณภาพเทียบเคียงของมียี่ห้อเลย|fake
โดยรวมแล้สดี พกะาง่าย แต่ยังมีน้ําหกออกมาหลังจากปิดฝาสนิทแล้ว แล้วหลอดก็ยังเก้ๆกังๆ แต่โดยรวมคือพึงพอใจ|fake
ได้รับของแล้ว ได้รับของแล้ว แต่ความจุได้ประมาณ 800 กรัม สั่งไปขนาด 1,300 กรัม ไม่ตรงตามที่แจ้ง ขอหักหนึ่งดาว คุณภาพคือดีเลย|fake
ได้รับของแล้วครับดีมากเลยครับตรงปกแนะนําร้านนี้เลยครับ|fake
ได้รับของแล้วจัดส่งพนักงานจัดส่งดีมากเลยจ้าแพ็คของก็ดีไม่มีรอยบุบหรือรอยแตกใดๆเก็บความเย็นก็ได้ข้ามคืนข้ามวันเลยแหละ|fake
ได้รับของแล้วแพ็คมาดี มีบับเบิ้ลกันกระแทกมาด้วย งานเรียบร้อยดี ขนาดไม่ตรงปกนะ สั่ง 1700 ml ได้ลองเอาน้ํา 1.5 ลิตรตวงดู กระติกไม่พอใส่ มีน้ําเหลือในขวด ขนาดจึงเล็กกว่าที่โฆษณาไว้ ขอให้แก้ไขให้ตรงกับสินค้า ด้วย ความซื่อสัตย์เป็นสิ่งสําคัญในการค้าขาย ยังไม่ได้ลองใช้ดูว่าคุณภาพจะเป็นเช่นไร ถ้าใช้ดีแล้วจะบอกต่อ|fake
ได้รับแล้วสินค้าตรงปกส่งไวตามกําหนด|fake
ได้รับสินค้าถูกต้องตรงตามคําสั่งซื้อเรียบร้อยแล้ว ขนาดเหมาะสมกับการนําไปใช้ใส่เครื่องดื่ม เก็บความเย็นได้นาน ล้างทําความสะอาดไม่ยุ่งยาก|fake
ได้รับสินค้ารวดเร็วมาก และแพ็คสินค้ามาอย่างดี คุณภาพเกินราคา วัสดุหนาดีมาก ต้องลองใช้ดูว่าเก็บความเย็นได้นานมั้ย|fake
ได้รับสินค้าเรียบร้อย ขนส่งเร็วดีตอนแรกมีขยายเวลาขนส่งนึกว่าจะช้าแต่ก็มาเร็ว สภาพกล่องบรรจุมาดีไม่ได้รับความเสียหาย สินค้าดีมีคุณภาพ เรื่องเก็บความเย็นต้องขอใช้งานดูก่อนถ้าดีจะสั่งซื้ออีก|fake
ได้รับสินค้าเรียบร้อยปล้วคะ สินค้าสีถูกใจ ใบใหญ่ดีคะ เก็บควาใเย็นได่ดี ใส่น้ําได้เยอะ ไม่ต้องเติมบ่อยๆ ดีๆๆๆๆๆๆ|fake
ได้รับสินค้าเรียบร้อยแร้วจ้า สมกับการรอ สินค้าตรงปกทุกอย่าง ไม่ชํารุดเสียหาย ราคาถูกมาก แนะนําร้านนี้จ้า|fake
ได้รับสินค้าเรียบร้อยแล้วครับ ได้รับสินค้าเรียบร้อยแล้วครับ ได้รับสินค้าเรียบร้อยแล้วครับ ได้รับสินค้าเรียบร้อยแล้วครับ|fake
ได้รับสินค้าเรียบร้อยแล้วนะคะ กระติกห่อมาอย่างดี แต่สั่งไป 1.7 ลิตร แต่พอเทน้ําลงไปแล้ว ได้แค่ 1.5 ลิตร|fake
ได้รับสินค้าแล้วค่ะรอนานไปนิดแต่ไม่รีบใช้สินค้าตรงปกสวยแต่จะเก็บน้ําแข็งนานรึไม่นานกําลังทดลองใช้อยู่ค่ะถ้าได้นานจริงๆจะสั่งให้ลูกๆด้วย|fake
ได้รับสินค้าแล้วค่ะรอนานไปนิดแต่ไม่รีบใช้สินค้าตรงปกสวยแต่จะเก็บน้ําแข็งนานรึไม่นานยังไม่ได้ลอง ขนาดเหมือนจะเล็กกว่าที่เคยสั่งมา|fake
ได้รับสินค้าแล้วค่ะสินค้าส่งรวดเร็วแพ็คมาอย่างดีเป็นสินค้าใหม่คุณทรงโทรแจ้งก่อนส่งสินค้าไว้จะกลับมาอุดหนุนให้นะ|fake
ได้รับสินค้าไว้เรียบร้อยแล้ว ส่งสินค้าก้อนกําหนด ยังไม่ได้ทดลองใช้ไม่รู้เก็บความเย็นได้นานเท่าไหร่ แต่สินค้าดูดี ราคาหักส่วนลดแล้วราคาใช้ได้ไม่ถึงร้อย|fake
ตรงปก ลองแล้วใช้งานได้ดีครับ|fake
ตรงปกคับ ขนาด ใหญ่โบ้ดีคับ สมใจ ไว้ใช้งาน นอกสถานที่ เหมาะเก็บได้นานอยู่ อย่าเอาไปตากแดดละ มันผิดประเภท|fake
ที่แล้วเป็นพรีออเดอร์รอนานสักพักนึงแต่พอมาส่งถึงบ้านก็โอเคครับถูกใจมากๆโดยเฉพาะลูกสาวนางชอบมากเลยบอกพ่อทําไมไม่เอาสีแดงพ่ะน่ะ|fake
ผิดหวังเล็กน้อย สั่งขนาด1300 ml แต่ได้ขนาด1000ml เก็บความเย็นก็ไม่ดีใส่น้ําแข็งเต็มกระติกใว้คืนเดียว เช้ามาละลายเหลือไม่ถึงครึ่ง ขนส่งเร็วพอได้แพ็คมาดีพอสมควร|fake
พรีออร์เดอร์เตรียมจัดส่งภายใน 7 วัน|fake
แพ็คสินค้าประหยัดบับเบิ้ลไปหน่อย ตูดบุบเลย ถ้าเทสคุณภาพผ่าน ก็คงจะต้องเปลี่ยนไปซื้อร้านอื่น เพราะถ้ามีปัญหาก็ต้องเสียเวลาเคลม|fake
แพ็คสินค้ามาอย่างดี ได้รับสินค้ารวดเร็ว พนักงานดีค่ะ โทรหาก่อนส่งของ ยังไม่ได้ลองใช้ ถ้าใช้แล้วดี เด้วมารีวิวให้อีกทีนะคะ|fake
แพคสินค้าไม่ดีครับ ห่อบับเบิ้ลบางๆแล้วใส่ถุง กล่องก็บุบบู้บี้ ลูกค้าสั่ง 4 อัน สมควรใส่กล่องนะครับ จะนําไปเป็นของขวัญ เลยไม่ได้พิสูจน์ว่าจะเก็บความเย็นหรือเปล่า รอสินค้า 5 วันครับ|fake
ไม่ได้เรื่องค่ะร้านนี้ สั่งสินค้าเบอใหญ่ได้เบอเล็ก ไม่ปลื้มเลยค่ะถ้าให้ดีก็อย่าขายเลยค่ะ หลอกลวงลูกค้า เสียอารมณ์ ไม่ได้ของตามสั่ง|fake
รอนานหน่อย แต่ความคุ้มค่าเกิน 1000% ใช้โค้ด ส่วนลด ได้ราคาถูกที่สุด 44 บาท สินค้าบรรจุพัสดุ double 2 ชั้น ดีเยี่ยมๆๆๆ|fake
ร้านค้า​นี้​แนะนําเลยครั​บ สินค้า​ใช้​งาน​ดีมาก เก็บความ​เย็น​ได้นาน ทาง​ร้านค้า​มีบริการ​ที่ดีมาก ผมรับรองเลยว่าถ้าได้มีโอกาส​ซื้อ​สินค้า​กับทาง​ร้านค้า​นี้​ แล้ว​จะ​ประทับใจ​|fake
สวย ทน ดีมากกกกกกกกกกกกกกกครับ แตทําใจรอนิดนึง ประมาณ 20 วัน ของครบ สั่งมา2ใบราคา ถูกครับไวจะสั่งเพิ่ม|fake
สวยงาม ได้ตามที่สั่ง ลองใช้ดูก่อน เก็บความเย็นขนาดไหนจะมารีวิวอีกครั้ง ราคาไม่แพง ร้านจัดส่งไว ส่งจริงค่ะ|fake
สวยตรงปกคะราคาถูกใจมากๆส่งไวแพ๊คสินค้ามาดีซื้อร้านนี้ได้เลยคะ|fake
สวยแฟนบอกว่าชอบบบ่นนว่าอยากได้แบบนี้ก็เลยจัดให้สวยมาก สวยแฟนบอกว่าชอบบบ่นนว่าอยากได้แบบนี้ก็เลยจัดให้สวยมาก|fake
สั่งวันที่ 1/5/67 ได้รับ 5/5/67 รอไม่นานค่ะ แต่ประทับใจมาก ใบใหญ่มากค่ะ ขนาดตรงตามสั่ง ใช้ดีค่ เก็บร้อนเก็บเย็นดีมากค่ะ ราคาถูกกว่าหลายไปร้าน แถมได้ส่วนลอลาซาด้าเพิ่มมาอีกด้วย คุ้มมากๆค่ะ เอาไว้จะแนะนําเพื่อนๆให้มาอุดหนุนนะคะวัสดุสแตนเลสคุณภาพเยี่ยม!, ง่ายต่อการทําความสะอาด ไม่ยุ่งยาก!,|fake
สั่งสีน้ําเงิน1,700ml ได้สีเขียว1,300ml ไม่เป็นไร แต่ขี้เกียจเสียเวลาคืนสินค้า ทางร้านน่าจะดูคําสั่งซื้อให้ดีก่อนจะเเพ็คสินค้าจัดส่ง|fake
สินค้าจัดส่งมาเรียบร้อยดีมากๆ คุณภาพหายห่วงโดยรวมแล้วคุ้มค่าคุ้มราคา แน่นอนล่ะไว้มีโอกาสหน้าจะใช้บริการซื้ออีกรอบ และบอกต่อหากมีคนถามว่าซื้อที่ไหน สรุปแล้วโดยรวมแล้วคุ้มค่าคุ้มราคาดีมากๆ|fake
สินค้าดี การจัดส่งดีมากกกกกสินค้าดี การจัดส่งดีมากกกกสินค้าดี การจัดส่งดีมากกกกสินค้าดี การจัดส่งดีมากกกก|fake
สินค้าดูแข็งแรงทนทานดีค่ะ แถมมีรับประกัน180วันด้วย ที่ซื้อประกันแก้วไว้ เผื่อว่าแก้วเสียหายอะไรจะได้เปลี่ยนใหม่ได้เลย|fake
สินค้าตรงตามที่ต้องการ​ การจัดส่งรวดเร็ว​ทันใจ ราคาถูกกว่าร้านอื่น​ ค่าจัดส่งไม่แพง​ แนะนําร้านนี้เลยครับ|fake
สินค้าตรงปก ระยะเวลาในการจัดส่งนั้นแล้ว12วัย กราบแพกของมาไม่มีการเสียหายใดๆๆๆ ใาลองใช้งาน เก็บความเย็นได้ดี|fake
สินค้าตรงปกคุณภาพดีมากเก็บความเย็นได้ดีตลอดทั้งวันแม้อากาศจะร้อนมาก ส่งก็เร็วแพ็คมาเป็นอย่างดีถูกใจมากๆ|fake
สินค้า​ถูกใจมากค่ะ​ ตรงตามที่สั่ง|fake
สินค้ามีคุณภาพดีตามที่เสนอไว้ในรายละเอียด การจัดส่งรวดเร็ว แพ็คสินค่ามาดี ตรงต่อเวลา เป็นไปตามที่แจ้งไว้ทุกประการ|fake
สุดยอดการเก็บความเย็นผ่าน24ชม.ยังเอาอยู่ยกนิ้วให้เลย สีสวยถูกใจขนาดกําลังดี จะสั่งขนาดทั่ใหญ่กว่านี้|fake
สุดยอดคะตรงปกมากๆเลยถูกใจมากๆสวยดีมีคุณภาพมากมากนะใครที่ยังไม่สั่งแนะนําร้านนี้เลยคะตรงปกทุกอย่างคะสวย|fake
อันนี้ใช้ดีมากครับเก็บน้ําแข็งได้นานอยู่ทั้งวันก็ยังได้ถึง 24 ชั่วโมง ok ครับแล้วบรรจุน้ําแข็งได้มากด้วย|fake
โอเคส่งสินค้าช้าหน่อยแต่ได้ของตรงปกครับ|fake
