ได้ทดสอบพูดเเละไปพูดคุยกับเพื่อนๆ เพื่อนๆต่างเสียงเดียวกันว่า เสียงชัดเเละเสียงปกติไม่เเตก บอกเลยว่าเยี่ยมเลยค่ะ ขอบคุณที่ส่งไมค์นะคะ จัดเเพ็คดีเเละส่งไวมากค่ะ|fake
สภาพถือว่าดี เเพ็คมีมาก ส่งไว ไม่โกงของตรงปกติจริง100%|fake
เสียงดีมาก ตัวเล็กประหยัดพื้นที่ คุ้มครับ|fake
จัดส่วรวดเร็วมากค่ะ สินค้าอยู่ในสภาพสมบูรณ์|fake
สินค้าใช้งานได้ปกติ ส่งไว|fake
เสียงสุดยอดดีครับ เหมาะกับสายกําลังเริ่มต้นไม่ต้องลงทุนเยอะก็ได้เสียงดีใช้|fake
ร้านส่งเร็วตั้งแต่วันที่สั่ง แต่บริษัทขนส่ง ninjavan เอาไปเก็บไว้คนลังสินค้า2วัน|fake
ดีอ่ะ ใช้ง่ายมาก ชอบ วันหลังจะมาอุดหนุนใหม่นะคะ|fake
ดีครับ ส่งไว ใช้งานได้ดี|fake
ใช้ดีเลย|fake
ได้รับเรียบร้อย ซื้อให้ลูกชายเอาไว้เล่นเกม สินค้าส่งเร็วมากๆ|fake
ดีส่งเร็วก่อนกําหนด คุณภาพใส่กันกระเเทกคุณภาพใช้งานเสียงดีเสียงไม่เเตกใช้ได้ ส่วนเรื่องระยะการใช้งานเดะมาบอกอีกทีให้5ดาวไปก่อนรวมๆเเล้วคือดีมาก|fake
ดีมาก|fake
ได้ของไวมาก แพคขอมาดี|fake
โอเคดีครับ|fake
ใช้ดีมากครับบบบ|fake
ดีมากครับ|fake
ส่งไวมาก|fake
2วันได้ของ ส่งเร็วมาก|fake
ส่งเร็ว สินค้าโอเค    ต้องลองใช้งานดู|fake
เสียงดีมากๆ ส่งของไว ตัวเล็กกระทัดรัด ใช้งานง่าย เสียบกับคอมใช้ได้เลย ไม่ต้องปรับจูนเสียง0|fake
ตรงปก ยังไม่มีข้อตําหนิ|fake
ชอบครับ เสียงดี เคยทําหล่นไปหนึ่งรอบ ก็ยังปกติดีอยู่ ถือว่าดีมากครับ|fake
มาแล้วจ้า  จิ๋วแต่แจ๋ว  ลองเผินๆบ้างแล้ว ใช้ได้ดี ราคาเอื้อมถึง|fake
แพ็ค มาดีค่ะ ทุกอย่างโอเค|fake
สินค้าอยู่ในสภาพดีๆใช้งานง่ายๆเหมาะสมกับราคาราคาไม่แพงงงงข่อนข้างพึงพอใจอยู่ครับ|fake
แกะมาไม่มีตําหนิไมค์เสียงดีสวย|fake
ทนทานและใช้งานได้นาน,|fake
สินค้ามาถึงแล้วครับคุณภาพไมค์เหมาสมกับราคาเลยแนะนําอย่าเอาใกล้ปากมากไม่งั้นเสียงจะดังเกินไป|fake
เสียงดีค่ะ ซื้อมาแทยตัวเก่าที่พังไป|fake
จัดส่งเร็วมาก ตอบแชทก็ดี|fake
เห็นเขาบอกว่าดี|fake
เสียงที่ดีมาก!|fake
ใช้งานได้ดีมากครับ|fake
คุณภาพดีค่ะ|fake
ส่งไวมาก บรรจุแข็งแรง|fake
ส่งไว2วันได้ ซื้อตอนกลางเดือนได้มา1370 เสียงชัดดีไม่ต้องเอาปากจ่อก็ได้ยิน ไม่มีไฟแสบตา|fake
เสียงดี เสียงชัด ใช้เเล้วเสียงนุ่ม มีแต่คนถามทําไมเสียงดีขึ้น|fake
ของตรงปกเสียงดีครับ|fake
มันเยี่ยมมากๆเลน|fake
ได้รับสินค้าแล้วครับ แพ็คมาอย่างดีช้านิดหน่อยแต่รับได้|fake
ของส่งมาเร็วดี​ ตัวสินค้าโอเคครับ|fake
เสียงดีอย่างที่หวัง ไครงบ 1900++ อันนี้ใช้ได้ครับแนะนําเลยแต่ข้อเสียคือเสียงลมเข้าไมค์ครับต้องหาแผ่นซับเสียงมาคลุมไมค์ตังหากครับ ตัวไมค์ต้องการพื้นที่วางนิดเดียวไม่เปลืองพื้นที่ครับ|fake
ดีมีคุณภาพครับ เสียงดีมาก|fake
เยี่ยมมากๆ เสียงดี ลองสอบถามปลายสายแล้วระหว่างเสียบไมค์ กับไม่เสียบไมค์ เสียงแตกต่างกันชัดเจน|fake
ของคุณภาพ ส่งเร็วดีครับ|fake
ใช้แล้วเสียงดีมากๆๆๆๆๆ เหมือนเป็นคนใหม่ ไม่ใช่ตัวเอง คนทักว่าทําเสียงนุ่มขึ้น ดีขึ้น ไม่เป็นไมค์กากไมค์ก้าน|fake
ดีมากกกกกกก|fake
โอเคเลยครับราคาไม่เเพง เสียงค่อนข้างดีเลย|fake
สินค้าตรงตามปกค่ะ|fake
ดีมักกกก เสียงดีใช้ได้ ใส้แคชแบคจ่ายแล้วถูกลงมากกก|fake
ดีครับส่งไว|fake
ขอดีตรงปกทุกอย่าง|fake
มาในสภาพดีแพ็คแน่นหนา|fake
สินค้าตรงปกเสียงดีครับตัดการรบกวนได้ดีเลยแพ็คมาดีครับ|fake
สินค้าตรงปก เสียงดี ตามที่รีวิวในยูทูป แพ็คของมาดี ใส่กันกระแทก ส่งเร็ว 1-2 วัน ดีมากๆๆ|fake
ส่งของไวมากครับ บริการเรื่องการตอบข้อสงสัยดีมากครับ แพ็คของมาดี เรื่องเสียงดีมากครับ คุ้มเกินราคาครับ|fake
ไมค์ขนาดกําลังพอดี คุณภาพเกินราคา ลองใช้แล้วเพื่อนบอกว่าเสียงนุ่มมากก ชอบมากๆๆ|fake
ของถึงมือไวมาก จัดส่งดี คุณภาพดี ไม่ผิดหวัง|fake
ดีครับ|fake
ไมค์ดีรับเสียงกว้าง ชัดไม่มีช๊อตของเขาดีจริง|fake
สินค้าตรงปก รูปแบบสวยงาม และทันสมัย เชื่อม usb ได้ ดีจัง|fake
ใช้ดีครับ เสียงดีมาก|fake
ของดีมากครับโดนไป2ตัวลอยเลย หยอกๆครับ ใช้ดีมากครับ|fake
ใช้ดีมากค่ะขอบคุณมากนะค่ะ|fake
Microphone เสียงดีค่ะ ติดตั้งง่าย ใช้งานสะดวก มีรับประกัน สินค้าส่งมาเรียบร้อยและรวดเร็วดี|fake
ใช้ได้ดี|fake
เยี่ยมครับเสียงรบกวนน้อย รับเสียงได้ดี|fake
ได้รับพัสดุแล้วครับส่งรวดเร็ว แพ็คกิ้งมาอย่างดี ตรงปกทดลองใช้งานใช้ได้ปกติดี พนักงานส่งมารยาทดีมาก|fake
ส่งเร็วดี|fake
สินค้าแพ็คมาดีมากกกก ใช้งานได้ดีเยี่ยมเสียงดีมาก ไม่มีเสียงรบกวน คาดว่าจะกลับไปซื้อใหม่อีกค่ะ|fake
ดีครับรับเสียงดีมาก คุ้มค่า|fake
เสียงดีมากครับ|fake
ได้รับสินค้าแล้ว ตัวน้องเล็กเสียงดีเกือบเท่ารุ่นพี่เลย รุ่นนี้อยากได้มานานแล้วรอ12-12ก็จัดซะเลย0|fake
ส่งไวแพ็คดี|fake
ส่งไว ขอลองใช้ก่อนนะคับ|fake
