ของมาไวมาก|fake
สินค้าดีมาด|fake
ได้รับของไวมากกกกกกก สั่งของปุ๊ป ไม่นานทางร้านก็ขึ้นสถานะว่าแพ็คเลย สินค้าคุณภาพดีราคาไม่แพง แนะนําเลย|fake
น่าเล่นเล่นสนุกแก้เบื่อได้ไม่เหงาเล่นกับเพื่อน 2 คนจนถึง 7 คนเลยคุณภาพของก็ดีร้านนี้ดีมาก|fake
ของส่งมาตรงปกราคาไม่แพง|fake
สินค้าดีครับ|fake
ราคาถูกแต่ จัดส่งใส่ถุงมาเลยไม่มีกันกระแทก  กล่องบุบเล็กน้อย ข้างในเล่นได้ปกติ เกมส์สนุกดี ขนส่งมาเสียบไว้ที่รั้วไม่โทรแจ้ง|fake
การส่งกีค่ะเเต่ว่าน่าจะได้มาผิดนะคะเพราะสั่งอีกอัน|fake
ดีครับการจัดส่งสินค้ารวดเร็วทันใจมากครับการเเพ็กของมาอย่างดีไม่มีตํานิครับของเล่นเล่นสนุกกับลูกๆหลายๆเพื่อนครับๆ|fake
ดีมากกค่ะบวกยับๆคะ|fake
สินค้าดีชอบฟีเจอร์การสลับด้าน!,|fake
ขอบพระคุณลูกค้าที่อุดหนุนคะ ขอน้อมรับคําติชม และนําไปพัฒนาร้านต่อไป ขอบคุณคะ|fake
ได้รับสินค้าเร็วดี วัสดุคุณภาพดี เด็กๆที่าบ้านเล่นกันสนุก ราคาไม่แพง คิดว่าจะสั่งเกมอื่นมาอีก|fake
ของตรงปกค่ะแต่การ์ดอ่อนไปนิดนึง|fake
จัดส่งสินค้าให้ลูกค้ารวดเร็วทันใจสินค้าดีมีคุณภาพถูกใจครับไว้คราวหน้าจะสนับสนุนอีก|fake
ตรงปกคะ สวยดีคุ้มค่าคะตรงปกคะ สวยดีคุ้มค่าคะตรงปกคะ สวยดีคุ้มค่าคะตรงปกคะ สวยดีคุ้มค่าคะ|fake
สินค้าแพ็คมาดีมากครับ|fake
ดีมาก คุ้มค่า ขนส่งพูดจาดี ได้รับของเร็วมากๆๆๆๆ เเพ็คดีสินค้าไม่เสียหายเเม้เเต่นิดเดียว|fake
ได้รับสินค้าแล้วครับ สินค้าจัดส่งค่อนข้างเร็ว ตัวสินค้าตรงกับที่ลงในหน้าร้านค้า สินค้าแพ็คมสโอเค|fake
สินค้าไม่มีตําหนิ ตรงตามปกทุกอย่าง ขนส่งส่งได้ตามมาตรฐาน ไม่มีสินค้าชํารุด พนักงานทําตามขั้นตอนการขนส่งดี ใครจะซื้อแนะนําค่ะ ซื้อได้|fake
การจัดส่งบรรจุใส่กล่องมา ส่งไวค่ะ สินค้าตรงปกชอบตรงมีกล่องเหล็กค่ะ รอบหน้าอุดหนุนใหม่ค่ะ|fake
สินค้าตรงออเดอร์  การจัดส่งรวดเร็ว ขนส่งบริการดี|fake
คุณภาพดีมากกกกๆๆๆ ขนส่งดี ไม่มีรอยย โดยรวมถือว่าาดีมากกๆเลยย ประจับใจสุดดๆ สั่งอีกกรอบหน้าเเน่นอนน|fake
ได้รับแล้วครับได้110ใบ|fake
ได้รับสินค้าเรียบร้อยส่งไวตรงปกคนับได้รับสินค้าเรียบร้อยส่งไวตรงปกคนับได้รับสินค้าเรียบร้อยส่งไวตรงปกคนับ|fake
ได้รับของเร็วมากค่ะชอบมากครูพอใจมากเลยค่ะเอาไว้วันหลังจะมาอุดหนุนอีกนะคะ|fake
เล่นสนุกดี มีสีสรร และการเปลี่ยนแปลงตอนเล่น|fake
การ์ดเกมส์คุณภาพดี การ์ดไม่บาง หนากําลังดี บรรจุกล่องสวยงาม คุ้มค่าราคาที่จ่าย ร้านจัดส่งสินค้ารวดเร็วดีAAA:F0|fake
ของรับแล้วคร้า แพ็คมาดีชอบมากค่ะ|fake
เล่นแล้วสนุกค่ะ ว่าจะมาสั่งอีก แผ่นดูใหม่เล่นสนุก ได้เยอะราคาถูกด้วยค่ะตรงปกสุดๆ|fake
ความบันเทิงเพลิดเพลินมากมาย,|fake
จัดส่งรวดเร็ว สีสันสวยงาม จัดการการบรรจุดีมากมีใส่ถุงกันด้านในอีกชั้น ของไม่เสียหายเลย|fake
สินค้าถูกต้องครบถ้วนตามที่สั่งค่ะ จัดส่งรวดเร็วทันใจ สภาพกล่องไม่เสียหายใดๆ ของแท้ของใหม่ สนุก|fake
ของมาส่งไว คุณภาพดีครับไม่มีรอยตําหนิ เหมาะสําหรับการเล่นกับเพื่อนและครอบครัวครับๆๆๆ|fake
ส่งเร็วมากสั่งปุ๊บได้ปั๊ปสุดยอด|fake
สินค้าตรงปกค่ะลูกชายชอบค่ะ|fake
ได้รับสินค้าเรียบร้อยค่ะ ไม่มีอะไรเสียหาย สินค้าคุณภาพดีมาก ร้านค้าน่ารักแพ็คสินค้ามาอย่างดีจัดส่งเร็วมากค่ะ ขนส่งพนง.สุภาพมากๆ แนะนําร้านนี้เลยค่ะไม่ผิดหวังแน่นอน ไว้อุดหนุนใหม่นะคะ|fake
สวยถูกใจมากกล่องอย่างสวยแต่ติดตรงเล่นไม่เป็นเพราะมีตัวเลข2ด้านต้องศึกษาก่อนค่ะ|fake
ได้รับสินค้าเรียบร้อย สินค้าเล่นได้ไม่ได้รับความเสียหายใดๆ การบริการจากขนส่งก็ให้บริการดี|fake
ได้รับสินค้าตรงตามที่สั่ง รอสินค้าไม่นาน ร้านค้าจัดส่งไว ขนส่งโทรมาแจ้งก่อนเข้ามาส่ง|fake
ดีมากเลยครับส่งเร็วมาก ของคุณภาพดีเลยครับร้านแพ็คของเร็ว ส่งเร็ว รวมๆก็ชอบครับ|fake
ตรงปกเลื่อนมากเลยค่ะเป็นเกมที่เล่นสนุกมากเลยค่ะ|fake
สวัสดี​ครับ​เปิดตัว​อย่าง​เป็นทางการ​โครงการ​เหงือก​แห้ง​เรื่องสั้น​อารมณ์ดี​เพราะ​มีความสุข​หรอก​ครับ​เพราะ​มัน​คือ​เรื่องจริง​ไม่ได้​แต่​เลือก​|fake
ขอบพระคุณลูกค้าที่อุดหนุน และ กรุณามารีวิวสินค้าในครั้งนี้ กดติดตามร้านเพื่อรับคูปองส่วนลดในครั้งต่อไปคะ|fake
ส่งของเร็วบริการดี แนะนําร้านนี้ก่อนพบทางปุ๊บตอบปุ๊บถามปั๊บปั๊บถามปุ๊บ สว่างสดใสสวยรอรถอยู่ยังไม่ได้รถครับ|fake
สินค้าตรงปก  การจัดส่งรวดเร็วค่ะ  เด็กๆๆชอบ  ได้ส่วนลดค่าจัดส่งและส่วนลด  ราคาดีงาม  ฝึกสมองเด็กๆๆ|fake
ส่งข้อนข้างเร็วเพ็คของข้อนข้างดีตัวของเล่นได้ตามปกติสีมีซีดบ้างโดยรวมถือว่าดีมากครับ|fake
การ์ดสวยงาม ไม่บางไม่หนาจนเกินไป กําลังดี กล่องใส่ก็สวย เด็กๆชอบมาก ร้านแพคมาดี กล่องการ์ดไม่มีบุบ|fake
ได้รับสินค้าแล้วสินค้ามาส่งแต่ว่ากล่องพัสดุที่มาส่งนั้นฉีกขาดแต่ว่าสินค้าภายในไม่ได้รับความเสียหายเดี๋ยวจะลองเล่นดูก่อนแกะดูก่อน|fake
ได้รับของรวดเร็วดีค่ะะ ทันเล่นกับเพื่อนตอนเปิดปีใหม่ สินค้าไม่มีอะไรเสียหาย สภาพดีค่ะะ|fake
ได้รับการ์ดของเล่นแล้ว โดยรวมถือว่าโอเคเลย เอาไว้เล่นกับเพื่อนครอบครัวสนุกมากๆๆ ได้มาราคาถูกสุดๆ|fake
เกมอูโน่เกมการ์ดที่ใช้สมองและสามารถเล่นหลายคนเอาไว้เล่นในครอบครัวเหมาะสําหรับเด็กอายุ 7 ปีขึ้นไปค่ะ|fake
ถูกใจมาก มีกล่องใส่ให้เก็บเรียบร้อย แพคมาดีถูกใจมาก มีกล่องใส่ให้เก็บเรียบร้อย แพคมาดี|fake
เกมที่ยอดเยี่ยมสําหรับการรวมตัวและปาร์ตี้,|fake
จัดส่งเร็วมาก ได้รับของแล้วสินค้าโอเครดีสวยงาม เอาไว้เล่นสนุกๆเวลาไปแค้มป์ไม่หน้าเบื่อ ลองหามาเล่นกันคับผม|fake
สินค้าแพคมาดีไม่มีเสียหาย ได้รับถูกต้องครบถ้วน ขนส่งสินค้าไวได้รับรวดเร็วทันใจ เด็กๆสนุกเล่นเพลิน|fake
ดีครับครงปกทถกอย่าง|fake
ผมได้แค่สองสี เหลืองกับแดงส่วนตัวผมว่าจองปลอมเพราะตัวการ์ดที่ได้มีบางการ์ที่มีรอยถลอกครับ|fake
ตอบกลับจากร้านค้า - 2 สัปดาห์ก่อนทางเราได้รับรีวิวดีๆ จากคุณแล้วค่ะ ทางเรารู้สึกเป็นเกียรติอย่างยิ่งที่ได้รับการยอมรับจากคุณค่ะ และหวังว่าจะได้ให้บริการคุณอีกครั้งนะคะ0|fake
ส่งไวมากกล่องเหล็กสวยมีบุบนิดหน่อยกระดาษกําลังดีลูกชายชอบมากราคาไม่แพงเล่นสนุกดีค่ะ|fake
ดีมากครับเพราะผมเชื่อว่าหลายคนเห็นแล้วอยากกลับมาอีกครับมเนื่องจากเป็น|fake
กล่องเป็นรอยขูดขีด เพราะมีแพร็บพลาสติกแบบนุ่มๆ บางๆ หุ้มไว้ แค่นั้น.. แต่ก็ถือว่าราคาดีมากกก|fake
สินค้าดีสวยดีมีอุปกรณ์มาพร้อมชุดเลย ราคาน่ารัก แพคสินค้ามาดีมากๆ พนักงานส่งของดีนิสัยดีโทรมาก่อนทุกครั้งที่จะเข้ามา|fake
สินค้าห่อมาดีมีซีลพลาสติกมาแน่นหนา  ดูใหม่น่าใช้ไม่เสียหายจากการขนส่งใดๆ  เป็นกล่องเหล็ก  แต่ยังไม่ได้แกะดูด้านในกล่อง|fake
กล่องเก็บเป็นแบบโลหะ เป็นระเบียบ รักษาการ์ดได้ดีในระยะยาว ไม่ยุ่ยง่ายแบบกล่องกระดาษ|fake
ได้รับสินค้าเรียบร้อยแล้ว ครบถ้วน ไม่เสียหาย ซื้ออูโน่รอบที่ 2 แล้ว เด็กๆชอบเล่น ราคาถูก รอบนี้จัดมาอย่างละ 3 กล่อง|fake
ตอบกลับจากร้านค้า - 4  เดือนก่อนทางเราได้รับรีวิวดีๆ จากคุณแล้วค่ะ ทางเรารู้สึกเป็นเกียรติอย่างยิ่งที่ได้รับการยอมรับจากคุณค่ะ และหวังว่าจะได้ให้บริการคุณอีกครั้งนะคะ0|fake
สนุกมาก ส่งเร็ว ลูกสาวชอบมาก|fake
สั่งแบบ wild   ได้ลาย minecraft มาแทน ผิดหวังนะ ไม่อยากได้ลายอื่นที่ไม่ได้เลือกเลยยยยยยยย|fake
ตรงปกมากค่ะเล่นกับเพื่อนแล้วสนุกมาก ไม่มีฉีกขาด ร้านดีมากค่ะ แพ็คของดีไม่ตกหล่นอะไรเลย|fake
ดีมากเลยค่ะส่งไวด้วย|fake
