บรรจุภัณฑ์มาดีคะ|fake
ของไม่ชํารุดหรือเสียหายเลยถือว่าดีมาก!|fake
ได้ของใหม่เลยแกร ราคาดี|fake
ได้รับของแล้ว ตามรายการสั่งซื้อ ได้รับของแล้ว ตามรายการสั่งซื้อได้รับของแล้ว ตามรายการสั่งซื้อ|fake
ส่งเร็วมากค่ะ สินค้าอยู่ในสภาพดี ราคาถูกกว่าแอปส้ม แนะนําเลยค่ะ คุ้มมากๆ พนักงานขนส่งก็พูดจาดี|fake
ยังไม่ได้แล่นแต่การเพ็คของคือดี ของส่งไวมาก|fake
สินค้าดีราคาไม่แพงร้านค้าจัดส่งสินค้ารวดเร็วดีขนส่งบริการดีและจัดส่งเร็วค่ะๆ|fake
ของมาถึงแล้ว ของมาถึงภายใน5วัน ข่นส่งบริการดีมาก ของแพ็คมาดีใส่กันกระแทกมาหนามาก ไม่มีชิ้นไหนเสียหายเลย โดยรวมดรมากครับ|fake
เล่มวิธีการเล่นฉบับสมบูรณ์และวิธีเล่นเบื้องต้น โดยรวมมีคําผิดเยอะอยู่ค่ะ แต่ก็ไม่ได้มากมายอะไร และพอจะอ่านเข้าใจอยู่ รูปประกอบสวย อธิบายดี แต่ให้ที่ห่อมาเยอะมาก ใช้ไม่หมดค่ะ 555555|fake
งานดี แต่ผมนับการ์ดได้ 77 ใบ รวมการ์ดพิเศษ 6 ใบแล้ว อืมมมมมมมม แต่ก็เล่นได้ดีครับ ปล.แนะนําให้ซื้อแปลไทยเลยอธิบายกฎ เพราะ แค่การ์ด อธิบายกฎไม่ได้หมด ต้องเปิดวิธีเล่นไปด้วย ถ้าภาษาไทยจะง่ายและเข้าใจได้เร็วกว่า แต่ถ้าใครคล่อง ภาษาอังกฤษกฤษก็จัดได้ตามสะดวก.|fake
ดีค่าาสนุกมากเล่นได้หลายคนละก็บทบาทเยอะมากมีทั้งหมด75ใบ รายละเอียดบอกหมดเลยและวิธีการเล่นแต่แค่เป็นภาษาอังกฤษรวมๆแล้วคือดี👍🏻👍🏻👍🏻|fake
ร้านค้าจัดส่งสินค้าได้ไวมากค่ะ รอไม่นาน แพคมาดีมากๆ เด็กชอบ  ราคาไม่แพง มีส่วนลดใช้โค้ดได้ คุ้มราคาค่ะ|fake
เหมาะสําหรับคืนเล่นเกม|fake
สินค้าเล่นง่าย สะดวกต่อการเล่นมากค่ะ ขนส่งก็ดีของไม่ชํารุด เกมก็เล่นง่าย ภาพชัด ตัวหนังสือก็ชัด|fake
การ์ดเเข็งเเรงมาก ภาพสวยเ้วย|fake
ถูกและดีค่ะสีสวยกว่าที่คิดเยอะเลยชอบมากก|fake
ดีมากก|fake
เล่นกับเพื่อนได้เยอะเล่นได้หลายคนมาก|fake
โอเคมีตําหนินิดหน่อย|fake
ดีมาก แพ็คสินค้ามาอย่างเรียบร้อย|fake
สวมเปนตัวละคนที่มีบทบาทแตกต่างกัน เล่นกับเพื่อน ๆ ไม่เบื่อแน่|fake
อยากเล่นแล้วติดอย่างเดัยสต้องรอเพื่อนๆ กล่องไม่พังเลย สวยงาม เยี่ยม ชอบ อยากได้เก็มอื่นๆอีก|fake
ของตรงปก แต่ทําไมไม่มีซองให้ใส่การ์ดแต่ละใบ|fake
ได้รับของแล้วครับดีมากดีมากเลย Easy to learn and play,|fake
ได้รับสินค้าเรียบร้อย แล้วนะคับ สินค้าดีตรงตามที่แจ้งไว้ราคาดี ขนส่งรวดเร็วแนะนําร้านนี้|fake
ได้รับของแล้วค่ะ  ตอนแรกตกใจเพราะใส่ถุงมาทั้งๆที่ของเป็นกล่อง  แต่เปิดออกมาสภาพของนังดีอยู่ค่ะ ไม่เสียหาย  ยังไม่ได้ลองเปิดดูข้างในแต่คิดว่าโอเค|fake
เกมส์สนุกมากได้ส่วนลดเยอะด้วยเอาไปเล่นกับเพื่อนๆสนุกสุดๆเลยของส่งเร็วทันใจไม่ต้องรอนาน|fake
ได้รับสินค้าแล้วค่ะสั่งแล้ววันเดียวถึงเลยไวมากๆหลานสาวชอบมากเลยค่ะคืออะไรก็ไม่รู้เหมือนกัน 555|fake
ราคาถูกดี จัดส่งเร็วด้วย จัดส่งครบตามที่สั่งทุกออเดอร์เลย ราคาดี คุ้มค่ะ สั่งเลยๆๆๆ โดยรวมคือดีมาก|fake
ดีมาก​ ของส่งเร็วมาก​ 2วันมาส่งเลย​ สินค้าแพคมาดี​ กล่องมาสมบูรณ์เลย​ลูกเล่นทุกวันเลย|fake
ขนส่งมาเร็วมากค่า กล่องพัสดุถูกเจาะ แต่ข้างในไม่มีรอยค่ะ ยังไม่ได้แกะดูภายในเกมส์  ห่อบับเบิ้ลมา1ชั้น|fake
สั่งซื้อเป็นครั้งที่ 2 แล้วค่ะ ไม่ผิดหวังเลย|fake
ได้ของเร็วมากก เริศเว่อร์ กรุบๆค่ะ|fake
ส่งเร็วไม่มีของเสียหาย|fake
ของส่งเร็วมากคับสินค้าปกติดีไม่มีริยคับ|fake
ไม่เสียหายรอบหน้าอาจได้กลับมาสั่งอีกทุกอย่างครบไม่มีอะไรเสียหายเล่นสนุกแต่ได้กาตเสียมาสามใบ|fake
ทางร้านจัดส่งสินค้าไว ขนส่งบริการดี สินค้าได้รับในสภาพดีไม่มีเสียหายค่ะซื้อมาชองเล่นกับเพื่อนๆ ไปเจอใน Youtube มาทําให้อยากลองเล่นเลย 55555 ไว้มีโอกาสจะมาอุดหนุนใหม่จ้า|fake
ยอดเยี่ยมกระเทียมดองสินค้าตรงปกจัดส่งดีจัดส่งไวราคาโปรโมชั่นถูกคุ้มราคามาก|fake
จัดส่งไว สินค้าแพ๊คมาค่อนข้างดี แต่เนื่องจากยังไม่ได้แกะใช้ เบื้องต้นหากได้ใช้แล้วจะมาอัพเดตครับ|fake
คุณภาพสินค้าดีมาก ครบถ้วน ห่อมาโอเคสินค้าไม่เสียหาย จัดส่งเร็วมาก 3 วันได้สินค้า|fake
ดีมากเเุทภถูกด้วยไวด้วย ส่งไวเเถมยังมีการห่อด้านนอกเเละใน|fake
สนุกมากค่ะ เล่นได้หลายคน บทเยอะ ไม่เบื่อเลย แพคมาดี สมราคา ไม่แพงมากการ์ดถือว่าดูดี ไม่แย่|fake
ได้รับสินค้าครบถ้วน จัดส่งมาอย่างดี ไม่มีมีเสียหายค่ะ รอไม่นาน พนักงานจัดส่งบริการดี กล่องใหญ่ค่ะ|fake
ตามปก กล่องสวย ส่งไว น่าเล่นมากค่ะ|fake
ส่งเร็ว ของครบ และ ราคาดีค่ะ|fake
กล่องและของข้างในมีสภาพที่ดีเยี่ยม|fake
ส่งของมาเร็วมากสั่งของมาไม่กี่วันก็ถึงปลายทางแล้ว แพ็คกิ้งมาแน่นหนาไม่มีบุกเลยครับ|fake
ดีมากของไม่เสียหาย|fake
ได้รับของเเล้วครับ ไม่มีตําหนิครับ การ์ดสวยไม่มีขาดสภาพดีครับ รวมๆถือว่าดีมากๆครับ :D|fake
สภาพดีโอเคเลย|fake
กล่องมีรอย|fake
แพคของมาดี ได้รับในสภาพเรียบร้อย ส่งของไวมาก สั่งสามวันได้ของเลย ยังไม่ได้แกะเล่นแต่คิดว่าปกติ|fake
สวยงาม ของส่งไว ไม่มีชํารุด ใครกําลังมองหาร้านซื้อ แนะนําร้านนี้เลยคับ|fake
พัสดุส่งเร็วมากค่ะ สั่งวันที่ 8 ของถึงวันที่ 10|fake
ส่งเร็ว ได้รับครบตามที่สั่ง สินค้าอยู่ในสภาพดี ราคาถูกกว่าแอปส้ม ดีงาม สั่งบ่อย ครั้งก่อนส่งมาไม่ครบ ก็ส่งมาให้เพิ่มอย่างเร็ว|fake
คุณภาพสินค้าดี แพ็คมาอย่างดี ไม่มีรอยการกระแทก ใช้วลาในการจัดส่งไม่นาน ประมาณ 2 วันทําการ ได้รับสินค้าเรียบร้อย|fake
ส่งเร็วมากค่ะชอบๆ|fake
จัดส่งเรียบร้อยดีค่ะ แพคสินค้ามาดีไม่มีอะไรเสียหาย จัดรวดเร็วดีมากไม่มีปัญหา งานดีคุณภาพดีมากค่ะ|fake
ดีค่ะ เล่นได้หลายคน สนุกฉ่ํา|fake
จัดส่งเร็วมาก ห่อมาดี ไม่มีอะไรเสียหายครับ สั่งเมื่อวาน วันนี้มาส่ง|fake
คุณภาพคุณภาพ:สินค้าดีราคา:ราคาเหมาะสมเวลา:เวลาในการจัดส่งเวลาในการจัดส่งไม่ช้าไม่เร็วการขนส่งสินค้า:การขนส่งไม่เสียหายระดับความพอใจ:พอใจมาก...ไว้มีโอกาสจะสั่งร้านนี้อีกค่ะ|fake
ขนส่งรวดเร็วสินค้าตรงปกครับ แพ็คมาดีแนะนําร้านนี้ครับ|fake
ดีมากเลยครับ ถ้ามีวิธีเล่นภาษาไทยให้ด้วยจะดีมากครับ|fake
ส่งของไวมาก สินค้าคุ้มราคา|fake
สินค้าแพ็คส่งมาดี ไม่เสียหายเลยรวมๆคือดีมากๆ|fake
ส่งไวดีค่ะ 3วันถึง  ข้างในกล่องถือว่าดีเลยค่อนข้างโอเค แนะนําร้านนี้นะคะ☺️|fake
ดีมากชอบมากขอบคุณครับ|fake
ส่งเร็วมากค่ะ ราคาถูกด้วย|fake
จัดส่งไม่ช้า ไม่เร็วครับ สินค้าแพ็คใส่ถุงมา ตัวกล่องไม่เสียหายครับ ส่วนแผ่นการ์ด ไม่มีปัญหาอะไรครับ|fake
ได้รับสินค้ามาพักใหญ่แล้วค่ะเพิ่งมีโอกาสมารีวิวสินค้าดีราคาไม่แพงจัดส่งไวชอบค่ะคุณภาพดีเลย|fake
แพ็คมาดีค่ะ ขนส่งไว 2 วันได้ของค่ะ|fake
สภาพของกล่องดีมากเลยค่ะ แพ็คหนาแน่มาก คุณภาพของการ์ดก็ดีมากเลยค่ะ เยี่ยม|fake
สินค้าจัดส่งไวทันใจ สินค้าไม่มีตําหนิ|fake
ชิ้นนี้มาถึงแบบสมบูรณ์ค่ะ ไม่มีปัญหา แต่อีกกล่องก็คือ อึ้งอยู่|fake
ร้านค้าจัดส่งไว เกมส์สนุก เด็กๆ ชอบมาก ตอนแรกคิดว่าจะอยากไปสําหรับเด็กป.5 ป.2 สรุปติดใจชวนเล่นตลอด|fake
ราคาถูกดี จัดส่งเร็วด้วย จัดส่งครบตามที่สั่งทุกออเดอร์เลย ราคาดี คุ้มค่ะ สั่งเลยๆๆๆ โดยรวมคือดีมาก|fake
ดีเกินคาด ตอนแรกคิดว่าน่าจะเป็นกระดาษสีบางๆ เปิดถุงมาคือดีกล่องปกติดีไม่บุบ ไม่มีอะไรเสียหาย  คุณภาพคือไกล้ๆของแท้เลยแนะนําเลยครับ|fake
ดีๆๆๆมากตะของตรงปกมากก|fake
ได้รับสินค้าครบถ้วนถูกต้อง สินค้ามีคุณภาพดี ส่งไว แพ็คมาหนาแน่น สินค้าโอเค สภาพสมบูรณ์|fake
สภาพสินค้าตามราคา กล่องบุบตามมุมเเต่ไม่ส่งผลกระทบต่อการ์ดข้างในค่ะทางร้านค้าส่งไว เเต่ขนส่งมาส่งช้า ดีที่ไม่รีบใช้ค่า|fake
ดีมากค่าส่งตามกําหนดของตรกปกเป๊ะการ์ดเยอะมากราคาก็ถูกดีมากคะ|fake
ได้รับของไวมาก อยู่ในสภาพดี แต่การ์ดอาจจะบางไปหน่อย คงต้องซื้อซองใสมามส่เพิ่ม|fake
จัดส่งไวค่ะ แพ็คมาแน่นหนาดีค่ะ แต่เปิดออกมากล่องบุบนิดน่อย ไม่แน่ใจว่าเป็นระหว่างขนส่งหรือเป็นมาก่อนอยู่แล้ว|fake
คือดีมากของมาส่งไวมากขนส่งคุยง่ายเเต่เราไม่อยู่บ้านเลยยากหน่อย ดีมากคือเอาไปเล่นเเล้วสู้ราคาไม่ไหวเพราะภาษาไทยเเพงมากเลยเอาเเบบภาษาอังกฤษเพราะเราเเปลพอได้|fake
แพ็คดีมากกกกก ราคาไม่แพง ขนส่งบริการดี ของครบ ไม่มีรายขีดข่วน คุณภาพดี เล่นสนุกดีเล่นไม่ยากอะไร|fake
ร้านดีมากครับจัดส่งเร็วไม่กี่ก็ถึงครับไม่มีความเสียหายเเพ๊กมาดีสุดๆเดียวจะมาซื้อใหม่ครับ|fake
สินคัาดูดี มีคุณภาพเมาะสมสามารถใช้เล่นได้ดี สินค้าที่ได้รับตรงตามปก|fake
เป็นเกมที่สนุกมากครับน่าเล่นสุดๆเลยครับยินดีเพื่อนเล่นหลายๆคนมันยิ่งฝึกสมองและอารมณ์ดีมากครับ|fake
ได้รับของแล้วค่ะ ไม่มีความเสียหายใด ๆ เลย ส่งเร็งมากกกก นึกว่าจะไม่ทันให้นักเรียนได้เล่นด้วยกันหลังเปิดโรงเรียนแล้ว|fake
ได้รับสินค้ามาพักใหญ่แล้วค่ะเพิ่งมีโอกาสมารีวิวสินค้าดีราคาไม่แพงจัดส่งไวชอบค่ะคุณภาพดีเลย|fake
ได้ของแล้วนะครับ สินค้าตรงปก ครบทุกอย่าง ชอบๆ|fake
ส่งมาดีมากครับ ดีมาก แพ็คมาอย่างดี แต่ภายในมีรอยบุบนิดนึงแต่โดยรวมดีมากครับขนส่งไว3วันได้แล้ว|fake
สินค้าถูกแพ็คมาในสภาพดีค่ะส่งเร็วมากๆด้วยยยคนส่งพูดจาไพเราะมากค่ะ|fake
ดีครับส่งไวมากวันเดียวส่งแล้วครับ|fake
ตรงปกค่ะ ส่งไว ไว้ตะสั่งใกม่อีกเรื่อยๆเลยค่ะ ราคาดี ตรงปกค่ะ ส่งไว ไว้ตะสั่งใกม่อีกเรื่อยๆเลยค่ะ ราคาดี|fake
ได้ของไวมากกกกกก การ์ดเยอะมากภาพสวย กระดาษดรไม่ก๊อกแก๊ก ราคานี้ได้ถุงมาด้วย คุ้มสุดๆค่ะ|fake
แพ็คมาดีมาก ส่งเร็วด้วยแปปเดียวก็ถึงแล้ว สั่งไปไม่กี่วัน2-3วันก็ได้แล้ว ให้5ดาวเลยครับ|fake
กระดาษไม่แข็งมาก แต่ใช้เล่นได้ดี เทียบราคาเกินคุ้มครับ|fake
ได้รับของมาแล้ว ไม่เสียหาย คุ้มกับราคา ใช้คูปองส่งฟรีไปคุ้มที่สุดดของรอ 2-3 วัน โดยรวมแล้วถือว่าดีมากกก|fake
ตรงปก จัดส่งเร็ว ของไม่เสียหาย คุณภาพดีสมราคาได้เล่นแบบการ์ดแล้วต้องสนุกมากแน่ๆ ขอบคุณค่ะ|fake
ในการสนุกมากค่ะ เป็นการเล่นแบบกลุ่มเล่นที่โรงเรียนชอบมากๆค่ะสนุกจริงๆ แนะนําค่ะๆๆๆๆ|fake
การ์ดเยอะมากๆค่ะเล่นได้หลายคนเลยเราได้การ์ดเสียอยู่3ใบแต่รวมๆดีมากค่ะคู่มือก็เข้าใจง่ายดีค่ะ|fake
ส่งมาไวมาก|fake
สินค้าดีมากครับ|fake
ได้รับสินค้าเรียบร้อย ส่งเร็ว สินค้าไม่เสียหาย การ์ดหลากหลายบทบาท อุปกรณ์ครบถ้วน คําอธิบายชัดเจน|fake
งานดี แต่ผมนับการ์ดได้ 77 ใบ รวมการ์ดพิเศษ 6 ใบแล้ว อืมมมมมมมม แต่ก็เล่นได้ดีครับ ปล.แนะนําให้ซื้อแปลไทยเลยอธิบายกฎ เพราะ แค่การ์ด อธิบายกฎไม่ได้หมด ต้องเปิดวิธีเล่นไปด้วย ถ้าภาษาไทยจะง่ายและเข้าใจได้เร็วกว่า แต่ถ้าใครคล่อง ภาษาอังกฤษกฤษก็จัดได้ตามสะดวก|fake
มีบุบบ้าง แต่โดยร่วมข้างในดี|fake
ลูกชอบมากค่ะถูกใจไปเล่นกับเพื่อนๆแล้ว|fake
ว้าวกล่องสวยมากเลยครับชืนชมคําร้ํารึของเจ้าของร้านจริงๆครับสุดยอดไปเลย|fake
จัดส่งเร็วมาก ของตรงปกค่ะ ดีมากๆ|fake
ของมาครบถ้วนค่ะ แพ็คมาเรียบร้อยดี ของไม่เสียหายอะไร รวมๆแล้วดีเลยค่า|fake
แพ็คมาค่อนข้างดีค่ะ สินค้าไม่เสียหาย มีการ์ด 75 ใบและคู่มือภาษาอังกฤษ|fake
ของส่งตรงปก ดีครับ ขนส่งดีด้วย แนะนําเลยครับ|fake
การ์ดเป็นภาษาอังกฤษ ตัวละครเยอะมาก ส่งเร็ว ตรงตามที่บอกไว้|fake
ของดีครับส่งเร็วด้วย|fake
